,hotel_name,id,hotel_price,hotel_nreview,hotel_one_review,hotel_rating,great_for_walker_rating,restaurants_nearby,nearby_attractions,ranking,description,location_rating,cleanliness_rating,service_rating,value_rating,QA_number,room_tips_number
0,Boston Park Plaza,property_111418,181,4203,"Located in Downtown, this metropolitan luxury hotel offers spacious rooms, a bar and locker rooms.",4.0,100.0,114.0,57.0,#53 of 96 hotels in Boston,"Authentic heritage and contemporary sophistication attract travelers from around the world to Boston's most beloved hotel: Boston Park Plaza. Guests quickly discover that the 1927 historic hotel is still timeless and always in-style. The hotel features 1,060 guestrooms, 57 suites, Leica Store and Gallery, exclusive access to Lynx Fitness Club and TopGolf Swing Suites, fine dining from STRIP by Strega and all-American fare by Off the Common. The Boston Park Plaza is located in historic Back Bay, just steps away from America's oldest public park, the Boston Common. Within walking distance: shopping on Newbury Street, Theatre and Financial Districts, Faneuil Hall Marketplace, and a host of other historical Boston sites. Looking for meeting or event space? We’ve got that and more to accommodate even the most high-powered affairs. Our beautifully renovated 13,215 sq. ft. ballroom and 32 individual conference rooms, adapt for a wide variety of events for groups of 10 to 2,200.",4.5,4.5,4.0,3.5,137.0,100.0
1,Beauport Hotel Gloucester,property_10408119,258,468,"Stylish high-end hotel featuring elegant marina-view rooms with a rooftop bar, a beach and a fitness center.",4.5,93.0,34.0,21.0,#3 of 7 hotels in Gloucester,"To our guests,​

We've missed you so much!  We can’t wait to welcome you back to Beauport Hotel here in Gloucester. These past few months have presented many challenges, as we navigate these times and develop a positive and safe way forward, one that best serves our guests and team. We’ve had to create and plan “new ways of hospitality” – committing to providing guest experiences at the same level that we always have, while adjusting to keep our guests and employees protected, our single and greatest priority.

Our reopening is guided by a comprehensive set of health safety and sanitation procedures, with consult from many government and health organizations, the American Hotel and Lodging Association, and our own founding - as well as the procurement of the very best sanitation resources, products, and practices. 

Please visit our website, <a data-encoded-url=""RmdrX2h0dHA6Ly9CZWF1cG9ydEhvdGVsLmNvbV83Rmg="" class=""_2wKz--mA a3Y9GQ0Y"" target=""_blank"" href=""http://BeauportHotel.com"">BeauportHotel.com</a> to see our comprehensive BSafe commitment to Health and Safety guidelines and protocols",5.0,5.0,4.5,4.0,10.0,100.0
2,Seaport Hotel,property_94330,359,5998,"Idyllic family-friendly hotel in Seaport District offering spacious ocean-view rooms with a breakfast buffet, bikes for guests and a heated pool.",4.5,98.0,57.0,7.0,#10 of 96 hotels in Boston,"The Seaport Hotel has re-opened, effective July 22nd, and the well-being of our guests, team members, vendors and community remains our highest priority.  We will continue to follow all Federal, State and Local regulations as we plan to welcome you back.   Should we need to revise our operation plans at any point based on their directions, we will certainly do so.  TAMO Bistro + Bar will reopen to the public on July 22 from 4 - 10 pm daily.  The Seaport Cafe will open on July 22, only to hotel guests, from 6:30 am - 2 pm.  Wave Health &amp; Fitness will reopen at a later date, however the swimming pool will open by August 6 to hotel guests but it will remain closed Mondays - Wednesdays.  Aura restaurant will remain closed.  Please note the Seaport Garage has been and continues to remain open. Our website will remain the best  source for updates and hours of operation – <a data-encoded-url=""eGdhX2h0dHA6Ly93d3cuc2VhcG9ydGJvc3Rvbi5jb21fdnRs"" class=""_2wKz--mA a3Y9GQ0Y"" target=""_blank"" href=""http://www.seaportboston.com"">www.seaportboston.com</a>.  We look forward to welcoming you back to Seaport.",4.5,5.0,5.0,4.5,104.0,100.0
3,The Charles Hotel,property_214890,301,2436,"Metropolitan business-friendly hotel offering spacious sleek rooms with bikes for guests, a heated pool and a bar.",4.5,100.0,95.0,32.0,#4 of 21 hotels in Cambridge,"Located just minutes from downtown Boston and a variety of world-class attractions, The Charles is a AAA Four Diamond Hotel and a proud member of Preferred Hotels and Resorts. Reflecting the eclecticism that is Cambridge, The Charles Hotel is a modern interpretation of New England hospitality with a thriving jazz club, the Regattabar; two signature restaurants: Henrietta's Table and Benedetto; seasonal farmers market; state of the art conference facilities; Corbu Spa &amp; Salon; and a central location in the heart of Harvard Square.",5.0,4.5,4.5,4.0,6.0,100.0
4,XV Beacon,property_94337,445,1264,"Romantic premium hotel in Downtown with chic rooms, a restaurant and a fitness center.",4.5,100.0,187.0,77.0,#19 of 96 hotels in Boston,"For a complete list of all we are doing please visit <a data-encoded-url=""OXFwX2h0dHA6Ly93d3cueHZiZWFjb24uY29tL2NvdmlkLTE5X3YxTw=="" class=""_2wKz--mA a3Y9GQ0Y"" target=""_blank"" href=""http://www.xvbeacon.com/covid-19"">www.xvbeacon.com/covid-19</a>",5.0,5.0,4.5,4.0,6.0,100.0
5,Omni Parker House,property_89599,222,9516,"Chic restored rooms in a quaint family-friendly hotel located in Downtown featuring a restaurant, hiking and a fitness center.",4.0,100.0,287.0,88.0,#58 of 96 hotels in Boston,"At Omni Hotels &amp; Resorts, the health and safety of our guests and associates has always been, and always will be, our top priority. COVID-19 has changed every facet of our world and the way we do business. In an effort to Stay A Part of Safety, we have updated our already thorough cleaning guidelines and implemented additional processes and procedures to ensure your health, safety and comfort as part of the new “Omni Safe &amp; Clean” initiative. The Omni Safe &amp; Clean initiative follows the guidelines set forth by the Centers for Disease Control and Prevention (CDC) and each individual Omni location will adhere to local and/or federal mandates. Protocols and guidelines from these authorities are expected to evolve, and as such, so will our below processes and procedures. Similarly, these guidelines meet or exceed the “Stay Safe” initiative set forth by the American Hotel &amp; Lodging Association (AHLA).",5.0,4.5,4.5,4.0,93.0,100.0
6,The Porches Inn at MASS MoCA,property_235273,157,954,"Lovely business-friendly hotel featuring snug rooms, board games and a breakfast buffet.",4.5,79.0,31.0,7.0,#1 of 3 hotels in North Adams,"The Porches Inn consists of seven renovated Victorian-era buildings that originally provided housing for the area’s mill workers. Located across the street from MASS MoCA, Porches’ guest rooms and public spaces employ a clever synthesis of retro and contemporary designs. The inn’s 47 rooms and suites are fully wired, offering free WiFi, BluRay/DVD players and complimentary DVDs. Porches' healthful continental breakfast is included in the room rate and may be eaten in the Breakfast Room, on the porch (weather permitting) or delivered to your room in the inn's signature metal lunchbox. The inn features a year-round heated outdoor pool, hot tub, sauna, bonfire pit, fitness room and meeting rooms for retreats and special events.",4.5,4.5,4.5,4.0,5.0,100.0
7,The Red Lion Inn,property_89873,170,1392,"Airy chic rooms in a romantic business-friendly hotel with a restaurant, evening entertainment and a hot tub.",4.0,72.0,10.0,7.0,,"Welcoming guests with genuine New England hospitality for over two centuries. Antique-filled rooms, suites, &amp; guesthouses. Contemporary regional cuisine, 3 restaurants, elegant &amp; casual indoor &amp; outdoor dining, award-winning wine list. Heated year-round outdoor pool &amp; hot tub, Gift Shop, WiFi. Live entertainment nightly in pub. Memorable weddings &amp; events. Small to mid-size meetings, unique spaces.",4.5,4.5,4.0,4.0,18.0,100.0
8,The Eliot Hotel,property_111423,395,1866,"Located in Back Bay, this romantic family-friendly hotel offers down-to-earth rooms, a bar and a concierge.",4.5,100.0,86.0,28.0,#2 of 96 hotels in Boston,"We hope this message finds you and your family safe and healthy. The unprecedented consequences of this pandemic have certainly been a challenge for us all. As we prepare for the eventual return to normalcy, we eagerly look forward to welcoming you to Boston and to The Eliot Hotel; your small, private and safe home away from home. Prospective guests can be assured that our suites will be prepared impeccably and our entire staff will be ready to provide the signature level of hospitality and service the Eliot is renowned for.

Thank you and stay safe!",5.0,4.5,4.5,4.0,29.0,100.0
9,Red Jacket Beach Resort,property_94048,150,768,"Welcoming mid-priced hotel offering bay-view rooms, a beach and a bar.",4.0,40.0,282.0,103.0,#5 of 21 hotels in South Yarmouth,"With 150 guest rooms and 14 multi-bedroom villas, the Red Jacket Beach Resort enjoys a fabulous location on 1,000 feet of private sandy beach on Nantucket Sound. Recently updated guest rooms; many offer spectacular views of the ocean. The resort features indoor/outdoor heated pools, as well as a zero-entry children's pool. The Kids' Club, a supervised children's program is offered during summer season along with family activities throughout the summer season on a complimentary basis. Also featuring on-site fishing, tennis, beach volleyball, and shuffleboard, with docking facilities available for small boats on Parker's River. The Red Jacket's dining room serves signature New England cuisine. The Red Jacket Beach is the perfect setting for corporate retreats, reunions, and tour groups, as well as for weddings and boasts 6,000 square feet of meeting and banquet space. Open from early April until late October.",4.5,4.0,4.0,3.5,33.0,100.0
10,The Whitney Hotel Boston,property_17581985,395,93,"Located in Beacon Hill, this lovely high-end hotel features breakfast, a fitness center and a concierge.",5.0,100.0,54.0,17.0,#3 of 96 hotels in Boston,"BEACON HILL’S NEWEST GEM. NOW OPEN. This summer, experience The Whitney Hotel, an unexpected find in Boston’s beloved Beacon Hill. The Whitney is a luxury boutique hotel reflecting the residential charm of our surrounding neighborhood. The Whitney balances the vibrancy of the city with our idyllic location, giving you easy access to the city's best attractions while also offering an escape from the hustle. Retreat to one of our 65 guestrooms, where you will be greeted with generous hospitality and cultured comforts. Explore our lush courtyard garden, enjoy savory Mediterranean cuisine at Peregrine, and indulge in our sophisticated amenities. We have everything you need to feel at home during your time in Boston.",5.0,5.0,5.0,4.5,3.0,15.0
11,Courtyard Boston Downtown/North Station,property_13403186,291,372,"Located in West End, this enchanting business-friendly hotel with contemporary city-view rooms offers evening entertainment, fitness classes and breakfast.",5.0,100.0,135.0,30.0,#7 of 96 hotels in Boston,"To all of our guests we wish you safety, comfort and health during this difficult time. The Courtyard Boston Downtown North Station is ready and waiting to serve visitors to Boston and look forward to hosting your stay. Stay safe and be well. #lovefromboston",5.0,5.0,4.5,4.5,21.0,57.0
12,Courtyard Boston Copley Square,property_313573,370,2106,"Located in Back Bay, this lovely business-friendly hotel offers stately rooms, breakfast and a fitness center.",4.5,100.0,166.0,60.0,#12 of 96 hotels in Boston,"In the midst of the Coronavirus (COVID-19) concerns, we would like to assure you that Courtyard Boston Copley Square places the highest priority on the health and safety of our guests and associates. 

The CDC recommends everyday preventive actions to help prevent the spread of respiratory illnesses like coronavirus/COVID-19. Recommendations include staying home when sick, washing hands often with soap and water for at least 20 seconds, following proper respiratory cough etiquette, avoiding close contact with people who are sick and avoiding touching eyes, nose, and mouth with unwashed hands.
 
We will also ask that every employee, guest and visitor abide by local regulations in place regarding the use of masks while you are inside the hotel and to abide by social distancing practices of at least 6 ft.  

We appreciate your business and loyalty to Courtyard Boston Copley Square. Our entire team is working hard to provide a safe environment for all to ensure the overall health &amp; safety.",5.0,4.5,4.5,4.5,41.0,100.0
13,Lenox Hotel,property_114134,295,3794,"Spacious casual rooms in a charming family-friendly hotel located in Back Bay offering bike rentals, a fitness center and a restaurant.",4.5,100.0,158.0,60.0,#8 of 96 hotels in Boston,"The health and well-being of our guests and employees are of the greatest importance to us. We are carefully monitoring the COVID-19 situation and are collaborating with city and state officials to stay fully informed. In addition to our always diligent housekeeping, we have proactively implemented extra resources and sanitary procedures as preemptive measures.

For more detailed information on what to expect, please visit our website directly at <a data-encoded-url=""ZGxCX2h0dHBzOi8vd3d3Lmxlbm94aG90ZWwuY29tL2hvdGVsLXNlcnZpY2VzLWR1cmluZy1jb3ZpZC0xOS9fdVNQ"" class=""_2wKz--mA a3Y9GQ0Y"" target=""_blank"" href=""https://www.lenoxhotel.com/hotel-services-during-covid-19/"">https://www.lenoxhotel.com/hotel-services-during-covid-19/</a>",5.0,5.0,5.0,4.5,47.0,100.0
14,Hyatt Centric Faneuil Hall Boston,property_15161474,280,216,"Contemporary rooms in a modern business-friendly hotel located in Downtown offering a fitness center, a concierge and breakfast.",4.5,100.0,342.0,106.0,#17 of 96 hotels in Boston,"Vibrant and Alive! Stay in the heart of one of America’s most celebrated cities and let Hyatt Centric Faneuil Hall Boston provide an uncomplicated travel experience for you, the modern-day explorer. Discover all that Boston offers from our central Downtown location. Your just steps away from historical landmarks, neighborhoods and major businesses including the Financial District, Freedom Trail, Post Office Square, Government Center, Faneuil Hall, Beacon Hill, Seaport, North End and the Theatre District.",5.0,5.0,4.5,4.0,2.0,11.0
15,Residence Inn Boston Downtown/Seaport,property_4232689,424,600,"Airy chic rooms in a lovely mid-range hotel located in Seaport District featuring free internet, free breakfast and a fitness center.",4.5,100.0,80.0,14.0,#20 of 96 hotels in Boston,"We are committed to offering an environment that aligns with expert protocols for working to defeat COVID-19. Consisting of in-house and outside experts in food and water safety, hygiene and infection prevention, and hotel operations, our Marriott Cleanliness Council is redefining our cleaning and safety standards. Starting with our public spaces and high-traffic areas, Marriott is going above and beyond our normal protocols. We are cleaning surfaces with increased frequency, dedicated staff, and recommended cleaning agents. Marriott has elevated our rigorous protocols to thoroughly clean all surfaces with hospital-grade disinfectants. We will be placing disinfectant wipes in rooms. Hand sanitizing stations are being installed at hotel entrances, at our front desks, our elevator banks, and meeting spaces. Signage in public spaces will remind Marriott guests to maintain social distancing. Read more about Marriott’s Commitment to Clean by visiting <a data-encoded-url=""SzNkX2h0dHBzOi8vY2xlYW4ubWFycmlvdHQuY29tLy5feEJp"" class=""_2wKz--mA a3Y9GQ0Y"" target=""_blank"" href=""https://clean.marriott.com/."">https://clean.marriott.com/.</a>",4.5,5.0,4.5,4.0,21.0,100.0
16,Jared Coffin House,property_144524,155,299,"Magnificent contemporary rooms in a charming mid-priced hotel with bbq facilities, beach access and a restaurant.",4.0,100.0,60.0,44.0,#11 of 13 hotels in Nantucket,"The Main House of this historic hotel dates back to 1845 and was the home of an affluent whaling captain. Today, this historic hotel welcomes guests to the Main House and directly next door, to the Daniel Webster House. Guests will find modern amenities with the newly refurbished library/parlor--where complimentary continental breakfast is served each morning. All rooms are air-conditioned. Free Wi-Fi is available in the rooms and throughout the hotel. Guest rooms have been updated with stunning traditional-style furniture. With the hotel's superb location, just steps from boutiques and excellent restaurants, guests enjoy wandering the cobblestone streets or visiting the many nearby museums and beaches.",5.0,4.5,4.5,3.5,3.0,64.0
17,Hilton Garden Inn Boston Logan Airport,property_8142646,229,1404,"Located in Harbor View, this welcoming family-friendly hotel with contemporary rooms offers a fitness center, beach access and a restaurant.",4.5,58.0,27.0,5.0,#22 of 96 hotels in Boston,"A Cleaner Stay from Check-in to Check-Out
Hilton has partnered with RB, makers of Lysol® &amp; Dettol®*, to help deliver an even cleaner stay for our guests with the Hilton CleanStay program. Building on our already rigorous cleaning standards, the program includes:

-Hilton CleanStay Room Seal&nbsp;to indicate that&nbsp;guest rooms haven’t been accessed&nbsp;since they were cleaned
-Extra disinfection of top 10&nbsp;high&nbsp;touch&nbsp;areas in&nbsp;guest&nbsp;rooms&nbsp;including light switches and door handles
-Increased&nbsp;cleaning&nbsp;frequency of&nbsp;public&nbsp;areas&nbsp;and fitness&nbsp;centers
-Guest-accessible disinfecting wipes&nbsp;at entrances and high traffic areas
-Enhanced cleaning &amp; other changes to&nbsp;buffets, in-room dining and meeting spaces
-Industry-leading&nbsp;contactless check-in and check-out with Digital Key&nbsp;at more than 4,700 properties globally

Our promise is to deliver the same level of reliable and friendly service you’d expect from Hilton, but with the added confidence of industry-leading hygiene practices created to keep you safe.",4.5,5.0,4.5,4.5,42.0,100.0
18,Hampton Inn Boston / Cambridge,property_253110,242,1371,"Metropolitan business-friendly hotel offering elegant contemporary rooms with free internet, a breakfast buffet and a fitness center.",4.0,87.0,131.0,15.0,#15 of 21 hotels in Cambridge,"A Cleaner Stay from Check-in to Check-Out
Hilton has partnered with RB, makers of Lysol® &amp; Dettol®*, to help deliver an even cleaner stay for our guests with the Hilton CleanStay program. Building on our already rigorous cleaning standards, the program includes:

-Hilton CleanStay Room Seal&nbsp;to indicate that&nbsp;guest rooms haven’t been accessed&nbsp;since they were cleaned
-Extra disinfection of top 10&nbsp;high&nbsp;touch&nbsp;areas in&nbsp;guest&nbsp;rooms&nbsp;including light switches and door handles
-Increased&nbsp;cleaning&nbsp;frequency of&nbsp;public&nbsp;areas&nbsp;and fitness&nbsp;centers
-Guest-accessible disinfecting wipes&nbsp;at entrances and high traffic areas
-Enhanced cleaning &amp; other changes to&nbsp;buffets, in-room dining and meeting spaces
-Industry-leading&nbsp;contactless check-in and check-out with Digital Key&nbsp;at more than 4,700 properties globally

Our promise is to deliver the same level of reliable and friendly service you’d expect from Hilton, but with the added confidence of industry-leading hygiene practices created to keep you safe.",4.0,4.5,4.5,4.0,22.0,100.0
19,Beechwood Hotel,property_94324,147,579,"Pleasant business-friendly hotel offering contemporary rooms, a breakfast buffet and a fitness center.",4.5,50.0,21.0,1.0,#1 of 10 hotels in Worcester,"In the heart of the Commonwealth sits Central Massachusetts’s only AAA Four Diamond rated property, the Beechwood Hotel, a proud member of the Preferred Hotels &amp; Resorts Connect Collection. Artful and luxurious, this is an ideal location for both leisure and business travel. The boutique hotel features museum-quality art including century-old travel, music, and theatre themed lithographs, historical stained glass pieces, distinctive architecture, and a black walnut fireplace that formerly resided in a 1800s-era New England homestead. Savor fine dining at the renowned DiRōNA Awarded Sonoma Restaurant, recognized for dining excellence by the Distinguished Restaurants of North America. Fifty-two European-inspired deluxe guestrooms and 21 elegantly appointed suites equipped with luxurious amenities invite you to rest and rejuvenate in serene surroundings. Plantation shutters, a neutral color palate and high-end touches like granite countertops lend to upscale simplicity. Rest by a crackling hearth in one of the Beechwood’s Fireplace Suites or treat yourself to the ultimate experience with our Presidential Suite. If you’re planning a gathering or celebration, the Beechwood boasts over 8,000 square feet of flexible meeting and event space. Our distinguished Grand Ballroom accommodates up to 250 guests and is home to our Maria Gill Wilson Room, a historic chapel featuring breathtaking stained glass windows, a soaring cathedral ceiling with hand-carved wooden beams, and elegant pendant lighting. The Beechwood is well-known for its impeccable service, award-winning cuisine, luxurious accommodations, and professional event planners. Located minutes from downtown Worcester and adjacent to Massachusetts Biotechnology Research Park, the Beechwood Hotel is right in the middle of everything. From the DCU Center to UMASS Medical School and popular area attractions, you’ll find all you need right around the corner. Carefree accessibility is made easy with Rt-290 bisecting the city. Those commuting in and out of Worcester have access to several major highways to the north, south, east, and west. Air travel is made seamless with the Worcester Regional Airport providing daily flights to Philadelphia, Orlando, New York City, and Fort Lauderdale. Boston Logan International Airport and the T.F. Green Airport are also nearby. Although there is plenty to do right in the heart of Worcester, visitors who want a taste of Boston can take the train out of Union Station, a beautifully restored historic building marked by two white marble towers. The Beechwood Hotel takes pride in being like nothing you expect and everything you deserve, and this shows in every facet of your experience. From the unsurpassed ambiance of Sonoma Restaurant to chic room furnishings, the Beechwood Hotel provides a distinct level of luxury for your home away from home. The Beechwood Hotel offers amazing amenities to enhance your stay and ensure that your experience exceeds your expectations.",4.5,4.5,4.5,4.5,3.0,88.0
20,The Inn At Longwood Medical,property_77638,212,122,"Metropolitan mid-priced hotel in Fenway featuring a gift shop, free wifi and a restaurant.",5.0,93.0,194.0,26.0,#9 of 96 hotels in Boston,"The Inn at Longwood Medical center is open and available for reservations.  All of our staff are in masks and we require our guests to wear masks as well.  There are ample hand sanitizing stations throughout the hotel.  Our Longwood Grille is open for dining with socially distanced tables, as is the Galleria Food Court.  Hotel public spaces are sprayed daily with electromagnetic sanitizer.",5.0,4.5,5.0,4.5,11.0,14.0
21,LakeHouse Inn,property_126089,165,251,"Restored lake-view rooms in a quaint mid-range hotel with breakfast, canoes and an outdoor fireplace.",5.0,0.0,0.0,0.0,#1 of 9 hotels in Lee,"Whether you are planning a relaxing retreat, seeking a couple's getaway, or traveling with a group, the LakeHouse Inn invites guests to experience a luxury waterfront stay. The Inn sits on top of a cliff providing some of the best Berkshire views and sunsets. The LakeHouse's accommodations, mindful service, waterfront location and amenities contribute to the true Berkshire experience.",5.0,5.0,5.0,4.5,3.0,63.0
22,Hilton Boston / Woburn,property_93974,183,513,"Contemporary rooms in a tranquil mid-priced hotel with public wifi, a bar and private balconies.",4.0,37.0,21.0,1.0,#4 of 13 hotels in Woburn,"A Cleaner Stay from Check-in to Check-Out
Hilton has partnered with RB, makers of Lysol® &amp; Dettol®*, to help deliver an even cleaner stay for our guests with the Hilton CleanStay program. Building on our already rigorous cleaning standards, the program includes:

-Hilton CleanStay Room Seal&nbsp;to indicate that&nbsp;guest rooms haven’t been accessed&nbsp;since they were cleaned
-Extra disinfection of top 10&nbsp;high&nbsp;touch&nbsp;areas in&nbsp;guest&nbsp;rooms&nbsp;including light switches and door handles
-Increased&nbsp;cleaning&nbsp;frequency of&nbsp;public&nbsp;areas&nbsp;and fitness&nbsp;centers
-Guest-accessible disinfecting wipes&nbsp;at entrances and high traffic areas
-Enhanced cleaning &amp; other changes to&nbsp;buffets, in-room dining and meeting spaces
-Industry-leading&nbsp;contactless check-in and check-out with Digital Key&nbsp;at more than 4,700 properties globally

Our promise is to deliver the same level of reliable and friendly service you’d expect from Hilton, but with the added confidence of industry-leading hygiene practices created to keep you safe.",4.0,4.0,4.0,4.0,9.0,45.0
